{
  "feature": "demo-pay",
  "generated_at": "2026-09-16T10:15:00Z",
  "template": {
    "id": "PRD评审-模板",
    "version": "3.32.0"
  },
  "feature_name": "演示支付",
  "prd_doc": "docs/PRD/demo-pay.md",
  "date": "2026-09-16",
  "host": "李四",
  "reviewers": [
    "业务-李四",
    "后端-张三",
    "前端-赵六",
    "测试-王五",
    "安全-钱七"
  ],
  "probes": [
    {
      "id": "P1",
      "name": "对抗场景走查",
      "owner": "全员（见 AW 清单）",
      "executed": true,
      "output": "§对抗场景走查（AW-1/AW-2）"
    },
    {
      "id": "P2",
      "name": "边界与极端值枚举",
      "owner": "测试+后端",
      "executed": true,
      "output": "§边界条件枚举（B-01/B-02）"
    },
    {
      "id": "P4",
      "name": "跨产物一致性核对",
      "owner": "业务+测试",
      "executed": true,
      "output": "PRD↔验收点↔老系统口径差异清单已核对，支付关闭口径一致"
    },
    {
      "id": "P5",
      "name": "决策 Why 链",
      "owner": "业务专家",
      "executed": true,
      "output": "支付渠道选型依据：费率 0.38% vs 0.6%（量化数据）"
    }
  ],
  "ambiguity_terms": [
    {
      "id": "T-1",
      "term": "支付单关闭",
      "prd_anchor": "§2.1",
      "ambiguity": "关闭指用户主动取消还是渠道侧失败",
      "resolution": "关闭=用户主动取消；渠道失败另称支付失败",
      "decider": "李四",
      "resolved": true
    }
  ],
  "no_ambiguity_evidence": "",
  "boundary_enums": [
    {
      "id": "B-01",
      "object": "amount 字段",
      "values": "0/负数/小数点后 3 位/超长",
      "prd_defined": false,
      "df_ref": "DF-01"
    },
    {
      "id": "B-02",
      "object": "同一订单重复创建支付单",
      "values": "并发重复提交",
      "prd_defined": true,
      "df_ref": ""
    }
  ],
  "aw": [
    {
      "id": "AW-1",
      "scenario": "支付回调在中途失败（网络抖动）",
      "path": "渠道回调→支付服务处理→回写支付单→返回应答失败→渠道重试",
      "df_refs": [
        "DF-01"
      ],
      "evidence_anchor": ""
    },
    {
      "id": "AW-2",
      "scenario": "同一订单并发提交两张支付单",
      "path": "用户双击提交→两个事务并发插入→唯一约束拦截其一",
      "df_refs": [],
      "evidence_anchor": "§3.2"
    }
  ],
  "df": [
    {
      "id": "DF-01",
      "title": "amount 为 0 与负数时 PRD 未定义行为",
      "role": "后端",
      "doc_anchor": "§2.3",
      "trigger_scene": "在【创建支付单】操作场景下，当【amount 传入 0 或负数】发生时",
      "impact_chain": "不澄清将导致脏支付单入库→对账差异→资损的传导路径",
      "root_cause": "边界遗漏",
      "suggestion": "补充校验规则：amount 必须 > 0，保留两位小数",
      "verify": "补充验收点 M01-F01-A03 后更新验收点清单",
      "severity": "P0",
      "status": "CLOSED"
    }
  ],
  "sf": [
    {
      "id": "SF-01",
      "title": "文案错别字",
      "role": "测试",
      "doc_anchor": "§1.2",
      "suggestion": "「支付单」统一写法"
    }
  ],
  "zero_df_roles": [
    {
      "role": "安全",
      "scope": "核查了支付接口鉴权与越权路径（横向/纵向）",
      "evidence_anchor": "§4.1",
      "verify": "P4 探针输出：接口权限矩阵与 PRD §4 一致"
    },
    {
      "role": "前端",
      "scope": "核查了支付表单校验与重复提交防护",
      "evidence_anchor": "§3.1",
      "verify": "走查 AW-2 并发提交场景已覆盖"
    },
    {
      "role": "业务",
      "scope": "核查了支付流程与 PRD §1-§3 业务口径一致性",
      "evidence_anchor": "§2.1",
      "verify": "P4 跨产物一致性核对输出：无口径差异"
    },
    {
      "role": "测试",
      "scope": "核查了验收点可测性与边界覆盖",
      "evidence_anchor": "§5",
      "verify": "P2 边界枚举输出：B-01/B-02 均有验证方式"
    }
  ],
  "risks": [],
  "leftovers": [],
  "conclusion_passed": true,
  "signoffs": [
    {
      "role": "产品经理",
      "name": "李四",
      "date": "2026-09-16"
    },
    {
      "role": "开发负责人",
      "name": "张三",
      "date": "2026-09-16"
    }
  ],
  "zero_results": [
    {
      "path": "risks",
      "reason": "评审未识别到需登记的项目级风险"
    },
    {
      "path": "leftovers",
      "reason": "全部 DF 已闭环，无遗留项"
    }
  ]
}